{
  "task_name": "",
  "repository": "",
  "branch": "",
  "base_commit": "",
  "head_commit": "",
  "authoritative_commit": "",
  "bundle_generated_after_commit": "",
  "review_bundle_metadata_mode": "POST_COMMIT_BUNDLE_WITH_SELF_REFERENCE_LIMITATION",
  "metadata_commit_consistent": true,
  "known_self_reference_limitation": "The review bundle is generated after the source commit; final git rev-parse HEAD is authoritative for repository state including bundle files. head_commit identifies the reviewed source revision.",
  "tests_run": "",
  "tests_passed": false,
  "ci_status": "",
  "generated_outputs_tracked": false,
  "raw_data_committed": false,
  "claim_boundary_passed": false,
  "product_readiness_stage": "TDF_DESIGN_CANDIDATE",
  "completed_work_updated": false,
  "next_actions_updated": false,
  "decision_log_updated": false,
  "prompt_log_updated": false,
  "cursor_feedback_log_updated": false,
  "cto_review_zip_created": false,
  "review_zip_path": "",
  "known_risks": [],
  "blockers": [],
  "next_recommended_step": ""
}
