{
  "authoritative_commit": "67b4f7197c1d520483436c66cbf47d5f698eb1a4",
  "base_commit": "50760712a9c4f19a03944f8e22c035a038e9d967",
  "blockers": [
    "CTO review required before push"
  ],
  "branch": "feature/generic-reviewer-package-builder-hardening",
  "bundle_generated_after_commit": "67b4f7197c1d520483436c66cbf47d5f698eb1a4",
  "ci_status": "CONFIGURED_LOCAL_ONLY_NOT_YET_RUN_ON_GITHUB",
  "claim_boundary_passed": true,
  "completed_work_updated": true,
  "cto_review_zip_created": true,
  "cursor_feedback_log_updated": true,
  "decision_log_updated": true,
  "generated_outputs_tracked": true,
  "head_commit": "67b4f7197c1d520483436c66cbf47d5f698eb1a4",
  "known_risks": [
    "CI workflow configured locally; GitHub Actions not yet verified until push",
    "Reviewer package builder not yet integrated with tdf-openmm-validation",
    "Real product package generation still blocked pending CTO approval"
  ],
  "known_self_reference_limitation": "The review bundle is generated after the source commit; final git rev-parse HEAD is authoritative for repository state including bundle files. head_commit identifies the reviewed source revision.",
  "metadata_commit_consistent": true,
  "next_actions_updated": true,
  "next_recommended_step": "CTO review of reviewer package builder bundle, then PR",
  "product_readiness_stage": "TDF_DESIGN_CANDIDATE",
  "prompt_log_updated": true,
  "raw_data_committed": false,
  "repository": "https://github.com/bahman2017/tdf-product-artifact-builder",
  "review_bundle_metadata_mode": "POST_COMMIT_BUNDLE_WITH_SELF_REFERENCE_LIMITATION",
  "review_zip_path": "project_control/cto_review_packages/20260626_generic-reviewer-package-builder-hardening.zip",
  "task_name": "generic-reviewer-package-builder-hardening",
  "tests_passed": true,
  "tests_run": "pytest -q (64 passed)"
}
