{
  "authoritative_commit": "00f17e6111ef4c1334d6855eff9192ac3bdd70f3",
  "base_commit": "b79987acc43c1d8a767f40892495ac751982f40d",
  "blockers": [
    "CTO review required before push"
  ],
  "branch": "feature/v0.1.0-release-authorization-review",
  "bundle_generated_after_commit": "00f17e6111ef4c1334d6855eff9192ac3bdd70f3",
  "ci_status": "CONFIGURED_LOCAL_ONLY_NOT_YET_RUN_ON_GITHUB",
  "claim_boundary_passed": true,
  "completed_work_updated": true,
  "cto_review_zip_created": true,
  "cursor_feedback_log_updated": true,
  "decision_log_updated": true,
  "generated_outputs_tracked": true,
  "head_commit": "00f17e6111ef4c1334d6855eff9192ac3bdd70f3",
  "known_risks": [
    "CI workflow configured locally; GitHub Actions not yet verified until push",
    "Release authorization review only; no tag, release, or publish performed",
    "Real product package generation still blocked pending CTO approval"
  ],
  "known_self_reference_limitation": "The review bundle is generated after the source commit; final git rev-parse HEAD is authoritative for repository state including bundle files. head_commit identifies the reviewed source revision.",
  "metadata_commit_consistent": true,
  "next_actions_updated": true,
  "next_recommended_step": "CTO review of release authorization bundle, then PR",
  "product_readiness_stage": "TDF_DESIGN_CANDIDATE",
  "prompt_log_updated": true,
  "raw_data_committed": false,
  "repository": "https://github.com/bahman2017/tdf-product-artifact-builder",
  "review_bundle_metadata_mode": "POST_COMMIT_BUNDLE_WITH_SELF_REFERENCE_LIMITATION",
  "review_zip_path": "project_control/cto_review_packages/20260627_v0.1.0-release-authorization-review.zip",
  "task_name": "v0.1.0-release-authorization-review",
  "tests_passed": true,
  "tests_run": "pytest -q"
}
